### ISSUE TITLE
Push Service is Slow/Times out

### ISSUE THREAD

**Issue by nielscil** [bitwarden/server#185]
I'm running Bitwarden on my own hosted device, but sometimes saving a login takes long (from mobile, browser of web vault). I found in the Core log that the push service can't be reached (see error log). I tested if the address could be reached from inside the docker container using ping and it does. Do you guys have a clue what the error could be? 

`2018-01-13 10:13:50.318 +00:00 [Error] Unable to send push notification.
System.Threading.Tasks.TaskCanceledException: A task was canceled.
   at System.Runtime.CompilerServices.TaskAwaiter.ThrowForNonSuccess(Task task)
   at System.Runtime.CompilerServices.TaskAwaiter.HandleNonSuccessAndDebuggerNotification(Task task)
   at System.Runtime.CompilerServices.ConfiguredTaskAwaitable1.ConfiguredTaskAwaiter.GetResult()
   at System.Net.Http.HttpClient.<FinishSendAsyncBuffered>d__58.MoveNext()
--- End of stack trace from previous location where exception was thrown ---
   at System.Runtime.ExceptionServices.ExceptionDispatchInfo.Throw()
   at System.Runtime.CompilerServices.TaskAwaiter.ThrowForNonSuccess(Task task)
   at System.Runtime.CompilerServices.TaskAwaiter.HandleNonSuccessAndDebuggerNotification(Task task)
   at Bit.Core.Services.RelayPushNotificationService.<SendAsync>d__18.MoveNext()`

**Comment by kspearrin** [comment]
This log happens when push times out. Does it happen every time?

**Comment by nielscil** [comment]
No not all the time, just randomly. Is there a way to debug this better?

**Comment by kspearrin** [comment]
@nielscil Perhaps monitor the outbound traffic of your server and see what is happening on the slow ones?

**Comment by nielscil** [comment]
So I tried monitoring it with TCPDump. The following is a normal push request:


> 18:34:18.185918 IP f865bcf99934.36818 > 104.31.71.251.https: Flags [.], seq 17668:19128, ack 4151, win 330, length 1460
18:34:18.185966 IP f865bcf99934.36818 > 104.31.71.251.https: Flags [P.], seq 19128:19435, ack 4151, win 330, length 307
18:34:18.199129 IP 104.31.71.251.https > f865bcf99934.36818: Flags [.], ack 19435, win 98, length 0
18:34:18.220469 IP f865bcf99934.52784 > bitwarden-mssql.docker_default.ms-sql-s: Flags [.], ack 137951, win 63, options [nop,nop,TS val 3060691824 ecr 3060691784], length 0
18:34:18.397417 IP 104.31.71.251.https > f865bcf99934.36818: Flags [P.], seq 4151:4566, ack 19435, win 98, length 415
18:34:18.397439 IP f865bcf99934.36818 > 104.31.71.251.https: Flags [.], ack 4566, win 330, length 0

And I had one slow one:

> 18:51:43.030607 IP f865bcf99934.36818 > 104.31.71.251.https: Flags [.], seq 19435:20895, ack 4566, win 330, length 1460
18:51:43.030671 IP f865bcf99934.36818 > 104.31.71.251.https: Flags [P.], seq 20895:21201, ack 4566, win 330, length 306
18:51:43.047474 IP f865bcf99934.33233 > bitwarden-mssql.docker_default.ms-sql-s: Flags [.], ack 3458, win 136, options [nop,nop,TS val 3061736651 ecr 3061736611], length 0
18:51:43.056466 IP f865bcf99934.36818 > 104.31.71.251.https: Flags [P.], seq 20895:21201, ack 4566, win 330, length 306
18:51:43.269481 IP f865bcf99934.36818 > 104.31.71.251.https: Flags [.], seq 19435:20895, ack 4566, win 330, length 1460
18:51:43.696474 IP f865bcf99934.36818 > 104.31.71.251.https: Flags [.], seq 19435:20895, ack 4566, win 330, length 1460
18:51:44.550475 IP f865bcf99934.36818 > 104.31.71.251.https: Flags [.], seq 19435:20895, ack 4566, win 330, length 1460
18:51:46.260480 IP f865bcf99934.36818 > 104.31.71.251.https: Flags [.], seq 19435:20895, ack 4566, win 330, length 1460
18:51:46.490553 IP 172.18.0.1.53418 > 239.255.255.250.1900: UDP, length 94
18:51:46.902067 IP 172.18.0.1.33162 > 172.18.255.255.32412: UDP, length 21
18:51:46.902260 IP 172.18.0.1.58267 > 172.18.255.255.32414: UDP, length 21
18:51:47.836463 ARP, Request who-has bitwarden-nginx.docker_default tell f865bcf99934, length 28
18:51:47.836484 ARP, Request who-has f865bcf99934 tell bitwarden-nginx.docker_default, length 28
18:51:47.836495 ARP, Reply f865bcf99934 is-at 02:42:ac:12:00:03 (oui Unknown), length 28
18:51:47.836500 ARP, Reply bitwarden-nginx.docker_default is-at 02:42:ac:12:00:07 (oui Unknown), length 28
18:51:48.044462 ARP, Request who-has 172.18.0.1 tell f865bcf99934, length 28
18:51:48.044495 ARP, Reply 172.18.0.1 is-at 02:42:98:67:66:34 (oui Unknown), length 28
18:51:49.676478 IP f865bcf99934.36818 > 104.31.71.251.https: Flags [.], seq 19435:20895, ack 4566, win 330, length 1460
18:51:51.902059 IP 172.18.0.1.33162 > 172.18.255.255.32412: UDP, length 21
...
18:51:56.490550 IP 172.18.0.1.53418 > 239.255.255.250.1900: UDP, length 94
18:51:56.508484 IP f865bcf99934.36818 > 104.31.71.251.https: Flags [.], seq 19435:20895, ack 4566, win 330, length 1460
18:51:56.902063 IP 172.18.0.1.33162 > 172.18.255.255.32412: UDP, length 21
...
18:52:06.490553 IP 172.18.0.1.53418 > 239.255.255.250.1900: UDP, length 94
18:52:06.902069 IP 172.18.0.1.33162 > 172.18.255.255.32412: UDP, length 21
...
18:52:10.172475 IP f865bcf99934.36818 > 104.31.71.251.https: Flags [.], seq 19435:20895, ack 4566, win 330, length 1460
18:52:11.902076 IP 172.18.0.1.33162 > 172.18.255.255.32412: UDP, length 21
...
18:52:16.490554 IP 172.18.0.1.53418 > 239.255.255.250.1900: UDP, length 94
18:52:16.902066 IP 172.18.0.1.33162 > 172.18.255.255.32412: UDP, length 21
...
18:52:26.490551 IP 172.18.0.1.53418 > 239.255.255.250.1900: UDP, length 94
18:52:26.902070 IP 172.18.0.1.33162 > 172.18.255.255.32412: UDP, length 21
...
18:52:36.490560 IP 172.18.0.1.53418 > 239.255.255.250.1900: UDP, length 94
18:52:36.902066 IP 172.18.0.1.33162 > 172.18.255.255.32412: UDP, length 21
...
18:52:37.500480 IP f865bcf99934.36818 > 104.31.71.251.https: Flags [.], seq 19435:20895, ack 4566, win 330, length 1460
18:52:41.902062 IP 172.18.0.1.33162 > 172.18.255.255.32412: UDP, length 21
18:52:41.902258 IP 172.18.0.1.58267 > 172.18.255.255.32414: UDP, length 21
18:52:42.508461 ARP, Request who-has 172.18.0.1 tell f865bcf99934, length 28
18:52:42.508492 ARP, Reply 172.18.0.1 is-at 02:42:98:67:66:34 (oui Unknown), length 28
18:52:42.823725 IP bitwarden-nginx.docker_default.56084 > f865bcf99934.http: Flags [F.], seq 2040, ack 1, win 115, options [nop,nop,TS val 3061796427 ecr 3061736423], length 0
18:52:42.824196 IP f865bcf99934.http > bitwarden-nginx.docker_default.56084: Flags [F.], seq 1, ack 2041, win 159, options [nop,nop,TS val 3061796427 ecr 3061796427], length 0
18:52:42.824227 IP bitwarden-nginx.docker_default.56084 > f865bcf99934.http: Flags [.], ack 2, win 115, options [nop,nop,TS val 3061796427 ecr 3061796427], length 0
18:52:46.490548 IP 172.18.0.1.53418 > 239.255.255.250.1900: UDP, length 94
18:52:46.902074 IP 172.18.0.1.33162 > 172.18.255.255.32412: UDP, length 21
...
18:52:47.836469 ARP, Request who-has bitwarden-nginx.docker_default tell f865bcf99934, length 28
18:52:47.836504 ARP, Request who-has f865bcf99934 tell bitwarden-nginx.docker_default, length 28
18:52:47.836511 ARP, Reply f865bcf99934 is-at 02:42:ac:12:00:03 (oui Unknown), length 28
18:52:47.836514 ARP, Reply bitwarden-nginx.docker_default is-at 02:42:ac:12:00:07 (oui Unknown), length 28
18:52:51.902051 IP 172.18.0.1.33162 > 172.18.255.255.32412: UDP, length 21
...
18:52:56.490547 IP 172.18.0.1.53418 > 239.255.255.250.1900: UDP, length 94
18:52:56.902074 IP 172.18.0.1.33162 > 172.18.255.255.32412: UDP, length 21
...
18:53:06.490552 IP 172.18.0.1.53418 > 239.255.255.250.1900: UDP, length 94
18:53:06.902068 IP 172.18.0.1.33162 > 172.18.255.255.32412: UDP, length 21
...
18:53:16.490553 IP 172.18.0.1.53418 > 239.255.255.250.1900: UDP, length 94
18:53:16.902065 IP 172.18.0.1.33162 > 172.18.255.255.32412: UDP, length 21
...
18:53:23.026656 IP f865bcf99934.36818 > 104.31.71.251.https: Flags [FP.], seq 21201:21232, ack 4566, win 330, length 31

Could it be something with the many UDP request? I haven't got a clue what this means.

**Comment by kspearrin** [comment]
Yea, not sure that is helping unfortunately. I'll have to monitor things from our side and see if I can locate the slowdown.

**Comment by nielscil** [comment]
Do you need any information from my side to monitor this?

**Comment by JokerQyou** [comment]
I'm experiencing slow push notification too, but with no error logs. Most of the time the mobile app and Chrome extension does not sync after I edited items on my web vault. I've tested several times and end up manually sync the data after having waited up to 40 minutes. I've also verified that there is no network issue from within the docker containers to bitwarden relay service.

I'm curious about this push notification architecture. As far as I understand, using GCM to receive push notification is reasonable if the user is using official bitwarden vault. But for self hosted vault and Chrome extension I'm not so sure. Why not simply check for data update directly from the user-provided API serve at interval? Like providing an `/api/delta` endpoint, and check it every 10 minutes if we're using self hosted service.

**Comment by kspearrin** [comment]
@JokerQyou We do a delta check periodically on the mobile app as well. It just happens less frequently than a push notification can occur.

**Comment by kspearrin** [comment]
Is this still an issue?

**Comment by nielscil** [comment]
Yes, I just enabled it a few days ago again and it still gives timeouts.

**Comment by djsmith85** [comment]
Hi @nielscil, it appears we've not heard from you about this issue in some time. While we are now closing this issue, if it continues to be a problem please feel free to re-open this issue and provide any further information that may be helpful in reproducing the problem or helping you further.
